{
  "schema_version": 1,
  "study_id": "{{STUDY_ID}}",
  "verdict_id": "VERDICT-0001",
  "created_at": "{{TIMESTAMP}}",
  "reviewer": {
    "identity": "[REPLACE]",
    "source": "human_authored"
  },
  "judged_scope": {
    "commit": null,
    "brief_sha256": "{{BRIEF_SHA256}}",
    "checkpoint": null,
    "claims": [],
    "evidence": []
  },
  "implementation_verdict": {
    "decision": "requires_changes",
    "rationale": "[REPLACE]",
    "conditions": []
  },
  "scientific_verdict": {
    "decision": "requires_more_evidence",
    "rationale": "[REPLACE]",
    "scope": "[REPLACE]",
    "conditions": []
  },
  "confirmation": {
    "typed_text": "[FILLED BY STUDYCTL]",
    "confirmed_at": "[FILLED BY STUDYCTL]"
  },
  "verdict_sha256": null
}
